{
  "$schema": "https://json-schema.org/draft/2020-12/schema",
  "$id": "https://llm-collab.dev/schemas/standalone/v1/message.schema.json",
  "title": "MessageV1",
  "type": "object",
  "additionalProperties": false,
  "required": ["schema_version", "workspace_id", "scope", "message_id", "body_ref", "recipients"],
  "properties": {
    "schema_version": {"const": 1},
    "workspace_id": {"$ref": "#/$defs/workspaceId"},
    "scope": {"$ref": "#/$defs/scope"},
    "message_id": {"type": "string", "pattern": "^(?!.*[\\u0000-\\u001f\\u007f\\u0085\\u2028\\u2029])msg_[A-Za-z0-9][A-Za-z0-9_-]{2,127}$"},
    "body_ref": {"type": "string", "pattern": "^(?!.*[\\u0000-\\u001f\\u007f\\u0085\\u2028\\u2029])body_[A-Za-z0-9][A-Za-z0-9_-]{2,127}$"},
    "recipients": {
      "type": "array",
      "minItems": 1,
      "maxItems": 256,
      "uniqueItems": true,
      "items": {"type": "string", "pattern": "^(?!.*[\\u0000-\\u001f\\u007f\\u0085\\u2028\\u2029])agent_[A-Za-z0-9][A-Za-z0-9_-]{2,127}$"}
    },
    "activation_import": {"$ref": "#/$defs/activationPacket"},
    "extensions": {"$ref": "#/$defs/extensions"}
  },
  "$defs": {
    "token": {"type": "string", "pattern": "^(?!.*[\\u0000-\\u001f\\u007f\\u0085\\u2028\\u2029])[A-Za-z][A-Za-z0-9._-]{0,127}$"},
    "workspaceId": {"type": "string", "pattern": "^(?!.*[\\u0000-\\u001f\\u007f\\u0085\\u2028\\u2029])ws_[A-Za-z0-9][A-Za-z0-9_-]{2,127}$"},
    "identityString": {
      "type": "string",
      "minLength": 1,
      "maxLength": 2048,
      "pattern": "^(?!\\s)(?!.*\\s$)(?!.*[\\u0000-\\u001f\\u007f\\u0085\\u2028\\u2029]).+$"
    },
    "canonicalPath": {
      "type": "string",
      "minLength": 2,
      "maxLength": 4096,
      "pattern": "^/(?!/)(?!.*//)(?!.*(?:/\\.{1,2})(?:/|$))(?!.*[\\u0000-\\u001f\\u007f\\u0085\\u2028\\u2029])[^/](?:.*[^/])?$"
    },
    "scope": {
      "type": "object",
      "additionalProperties": false,
      "required": ["kind"],
      "properties": {"kind": {"enum": ["workspace", "project"]}, "project_id": {"$ref": "#/$defs/token"}},
      "allOf": [{"if": {"properties": {"kind": {"const": "project"}}, "required": ["kind"]}, "then": {"required": ["project_id"]}, "else": {"not": {"required": ["project_id"]}}}]
    },
    "activationPacket": {
      "description": "Complete current-v2 lexical activation identity and compatibility provenance only. It does not confer SessionRef, native-session, lease, fence, or writer authority.",
      "type": "object",
      "additionalProperties": false,
      "required": ["activation", "project", "chat", "task", "worktree", "branch", "target_agent", "to"],
      "properties": {
        "activation": {"const": true},
        "project": {"$ref": "#/$defs/identityString"},
        "chat": {"$ref": "#/$defs/identityString"},
        "task": {"$ref": "#/$defs/identityString"},
        "worktree": {"$ref": "#/$defs/canonicalPath"},
        "branch": {"$ref": "#/$defs/identityString"},
        "target_agent": {"$ref": "#/$defs/identityString"},
        "to": {"$ref": "#/$defs/identityString"}
      }
    },
    "extensions": {
      "description": "Bounded non-authoritative annotations. Consumers must ignore these values for routing, trust, and execution.",
      "type": "object",
      "maxProperties": 8,
      "propertyNames": {"pattern": "^x_note_[A-Za-z][A-Za-z0-9_-]{0,55}$"},
      "additionalProperties": {"type": ["string", "number", "boolean", "null"], "maxLength": 512}
    }
  }
}
