{"schema_version":1,"workspace_id":"ws_alpha","scope":{"kind":"project","project_id":"proj"},"message_id":"msg_one","body_ref":"body_one","recipients":["agent_codex"],"activation_import":{"activation":true,"project":"proj","chat":"CHAT-047D932F","task":"TASK-F7AFAF","worktree":"/srv/workspaces/repos/app","branch":"feature/native-proof","target_agent":"codex","to":"codex"}}
